{
  "schemaVersion": 1,
  "id": "example-minimal-f2l",
  "name": "Minimal F2L sample",
  "stage": "f2l",
  "categories": [
    {
      "id": "easy-inserts",
      "name": "Easy Inserts",
      "icon": {
        "setup": "R U R' U'"
      },
      "cases": [
        {
          "id": "ei1",
          "name": "Connected pair insert (sample)",
          "setup": "R U R' U'",
          "angles": [
            {
              "id": "FR",
              "solutions": ["U R U' R'"],
              "completed": 0
            },
            {
              "id": "FL",
              "solutions": ["U' L' U L"]
            }
          ]
        },
        {
          "id": "ei2",
          "name": "Sparse angles (sample)",
          "setup": "F R U R' U' F'",
          "links": [
            {
              "label": "Cube Academy (example link)",
              "url": "https://www.cubeacademy.co.uk/"
            }
          ],
          "angles": [
            {
              "id": "front",
              "solutions": ["R U R' U R U2 R'"],
              "completed": 1
            }
          ]
        }
      ]
    }
  ]
}
